{
  "schema_version": "0.2.0",
  "agreed_between": ["GRP00001", "GRP00002"],
  "board_and_agents": {
    "grid_size": 7,
    "num_agents": 2,
    "axis_origin_corner": "top-left",
    "axis_start_index": 0,
    "thief_start": [3, 3],
    "cop_start": [0, 0]
  },
  "world": {
    "map_area": "",
    "hint_max_words": 15
  },
  "movement_and_barriers": {
    "move_set": ["N", "S", "E", "W", "STAY"],
    "max_barriers": 14,
    "max_moves": 35,
    "survival_threshold": 35
  },
  "pheromones": {
    "pheromone_center_intensity": "0.9",
    "pheromone_decay": "0.10",
    "pheromone_grid_size": 5,
    "kernel": [
      ["0.0625", "0.125", "0.25", "0.125", "0.0625"],
      ["0.125", "0.25", "0.5", "0.25", "0.125"],
      ["0.25", "0.5", "1", "0.5", "0.25"],
      ["0.125", "0.25", "0.5", "0.25", "0.125"],
      ["0.0625", "0.125", "0.25", "0.125", "0.0625"]
    ],
    "rounding": {
      "decimal_places": 6,
      "mode": "ROUND_HALF_EVEN"
    },
    "numeric_example": {
      "center_emission": "0.900000",
      "center_after_one_full_turn": "0.810000"
    }
  },
  "scoring": {
    "capture_cop": 20,
    "capture_thief": 5,
    "survival_cop": 5,
    "survival_thief": 10,
    "tie_score": 2
  },
  "network_and_league": {
    "num_games": 6,
    "diversity_reward": 10,
    "min_games_to_pass": 2,
    "token_budget_per_series": 200000,
    "max_games_per_team": 10,
    "response_timeout_sec": 30,
    "watchdog_timeout_sec": 60
  },
  "rate_limiter_gatekeeper": {
    "requests_per_minute": 30,
    "concurrent_requests": 2,
    "retry_backoff_sec": 5,
    "max_retries": 3,
    "queue_depth": 100
  },
  "extensions": {}
}
